{
  "$schema": "https://json-schema.org/draft/2020-12/schema",
  "$id": "https://trend-analyzer.local/contracts/envelope.v1.schema.json",
  "title": "Envelope canónico v1.0",
  "description": "Forma de todo evento al salir del simulador o del loader histórico (stream e histórico, cualquier fuente). Contiene author.user_id y author.handle, que NO existen después de la anonimización. ARCHITECTURE.md §5.2.",
  "type": "object",
  "additionalProperties": false,
  "required": ["schema_version", "event_id", "origin", "source", "generator", "seq", "event_time", "ingest_time", "author", "text", "brands", "hashtags", "payload", "sim"],
  "properties": {
    "schema_version": { "const": "1.0" },
    "event_id": { "$ref": "#/$defs/uuid", "description": "uuid5 determinista (§3.6). Clave de deduplicación." },
    "origin": { "enum": ["stream", "historical"] },
    "source": { "enum": ["reddit", "facebook", "instagram"], "description": "Red social simulada, también en histórico." },
    "generator": { "type": "string", "pattern": "^[a-z0-9][a-z0-9-]*@[0-9]+\\.[0-9]+(\\.[0-9]+)?$", "description": "Nombre@versión del generador, p. ej. comment-gen@1.0." },
    "seq": { "type": "integer", "minimum": 0, "description": "Posición del evento en la secuencia de su fuente (§3.5)." },
    "event_time": { "$ref": "#/$defs/timestamp_utc" },
    "ingest_time": { "$ref": "#/$defs/timestamp_utc" },
    "author": {
      "type": "object",
      "additionalProperties": false,
      "required": ["user_id", "handle"],
      "properties": {
        "user_id": { "type": "string", "minLength": 1, "description": "Estable. Solo existe hasta Dataflow/loader." },
        "handle": { "type": "string", "minLength": 1, "description": "Solo existe hasta Dataflow/loader." },
        "followers": { "type": ["integer", "null"], "minimum": 0, "description": "Puede ser nulo (caos §3.9)." }
      }
    },
    "text": { "type": "string", "minLength": 1, "description": "Texto plano: comentario del generador + hashtags añadidos (§3.8)." },
    "lang": { "type": ["string", "null"], "pattern": "^[a-z]{2}$", "description": "'es' en v2.2. Puede ser nulo (caos §3.9)." },
    "brands": { "type": "array", "items": { "$ref": "#/$defs/brand_key" }, "uniqueItems": true, "description": "Claves canónicas de brands.yaml. Puede ser []." },
    "hashtags": { "type": "array", "items": { "$ref": "#/$defs/hashtag" }, "uniqueItems": true, "description": "Forma canónica: minúsculas, sin '#', sin tildes, solo [a-z0-9_], sin repetidos y en orden de aparición en el texto. El texto conserva el hashtag tal como se escribió. Puede ser []." },
    "payload": { "type": "object", "description": "Específico de la red; se valida según `source` (allOf abajo)." },
    "sim": {
      "type": "object",
      "additionalProperties": false,
      "required": ["label_sentiment", "scenario", "chaos"],
      "description": "Ground truth y trazas. Nunca se usa como feature.",
      "properties": {
        "label_sentiment": { "enum": ["positive", "negative", "neutral", null] },
        "scenario": { "type": ["string", "null"] },
        "chaos": { "type": "array", "items": { "enum": ["duplicate", "late", "null_fields", "malformed"] }, "uniqueItems": true }
      }
    }
  },
  "allOf": [
    {
      "if": { "properties": { "source": { "const": "reddit" } }, "required": ["source"] },
      "then": { "properties": { "payload": { "$ref": "payload.reddit.schema.json" } } }
    },
    {
      "if": { "properties": { "source": { "const": "facebook" } }, "required": ["source"] },
      "then": { "properties": { "payload": { "$ref": "payload.facebook.schema.json" } } }
    },
    {
      "if": { "properties": { "source": { "const": "instagram" } }, "required": ["source"] },
      "then": { "properties": { "payload": { "$ref": "payload.instagram.schema.json" } } }
    }
  ],
  "$defs": {
    "uuid": { "type": "string", "pattern": "^[0-9a-f]{8}-[0-9a-f]{4}-[0-9a-f]{4}-[0-9a-f]{4}-[0-9a-f]{12}$" },
    "timestamp_utc": { "type": "string", "pattern": "^\\d{4}-\\d{2}-\\d{2}T\\d{2}:\\d{2}:\\d{2}\\.\\d{3}Z$", "description": "UTC, ISO-8601 con milisegundos y Z (§5.1)." },
    "brand_key": { "type": "string", "pattern": "^[a-z0-9_]+$" },
    "hashtag": { "type": "string", "pattern": "^[a-z0-9_]{1,100}$", "description": "Hashtag en forma canónica (sin '#'). Ver contracts/README.md, decisión 10." }
  }
}
