{
  "schema_version": "1.0",
  "event_id": "4217f11c-ddec-5cb3-842d-14dd07bcac4a",
  "origin": "stream",
  "source": "reddit",
  "generator": "comment-gen@1.0",
  "seq": 1207,
  "event_time": "2026-10-17T14:03:11.482Z",
  "ingest_time": "2026-10-17T14:03:13.020Z",
  "author": {
    "user_id": "u_000481",
    "handle": "u/mariag_89",
    "followers": 412
  },
  "text": "Mi aporte del día: no tolero Pepsi Cola en el trancón. Mejor me hubiera tomado un agua. Es mi opinión.",
  "lang": "es",
  "brands": [
    "pepsi"
  ],
  "hashtags": [],
  "payload": {
    "reddit_id": "t1_k3x9a1",
    "kind": "comment",
    "subreddit": "r/colombia",
    "title": null,
    "parent_id": "t3_j8f2ds",
    "score": 27,
    "upvote_ratio": null,
    "num_comments": null,
    "permalink": "/r/colombia/comments/j8f2ds/_/k3x9a1/",
    "flair": null
  },
  "sim": {
    "label_sentiment": "negative",
    "scenario": null,
    "chaos": []
  }
}
